{
  "meta": {
    "name": "prerelease-monorepo",
    "description": "Monorepo with one package on alpha channel and two stable packages"
  },
  "config": {
    "content": "{\n  \"workspace\": {\n    \"branches\": [\n      {\n        \"name\": \"main\",\n        \"channel\": \"alpha\",\n        \"prereleaseIdentifier\": \"increment\"\n      }\n    ]\n  },\n  \"package\": [\n    {\n      \"name\": \"core\",\n      \"path\": \"core\",\n      \"versioned_files\": [{\"path\": \"core/version.toml\", \"format\": \"toml\"}]\n    },\n    {\n      \"name\": \"cli\",\n      \"path\": \"cli\",\n      \"versioned_files\": [{\"path\": \"cli/version.toml\", \"format\": \"toml\"}]\n    },\n    {\n      \"name\": \"web\",\n      \"path\": \"web\",\n      \"versioned_files\": [{\"path\": \"web/version.toml\", \"format\": \"toml\"}]\n    }\n  ]\n}\n"
  },
  "packages": [
    {
      "name": "core",
      "path": "core",
      "initial_version": "1.0.0",
      "tag": "core@v1.0.0"
    },
    {
      "name": "cli",
      "path": "cli",
      "initial_version": "1.0.0",
      "tag": "cli@v1.0.0"
    },
    {
      "name": "web",
      "path": "web",
      "initial_version": "1.0.0",
      "tag": "web@v1.0.0"
    }
  ],
  "commits": [
    {
      "message": "feat(core): add new parser",
      "files": ["core/src/parser.rs"]
    },
    {
      "message": "fix(cli): handle empty args",
      "files": ["cli/src/main.rs"]
    }
  ],
  "expect": {
    "check_contains": ["core", "cli"],
    "check_not_contains": ["Nothing to release", "web"]
  }
}
