{
  "meta": {
    "name": "changelog-multi-release",
    "description": "Two rounds of commits with tags — changelog only includes commits since last tag"
  },
  "config": {
    "content": "{\n  \"package\": [\n    {\n      \"name\": \"myapp\",\n      \"path\": \".\",\n      \"versioned_files\": [{\"path\": \"version.toml\", \"format\": \"toml\"}],\n      \"changelog\": \"CHANGELOG.md\"\n    }\n  ]\n}\n"
  },
  "packages": [
    {
      "name": "myapp",
      "path": ".",
      "initial_version": "1.0.0",
      "tag": "v1.0.0"
    }
  ],
  "commits": [
    {
      "message": "feat: first feature",
      "files": ["src/first.rs"]
    }
  ],
  "tags": [
    {
      "name": "v1.1.0",
      "at_commit": 0
    }
  ],
  "expect": {
    "check_contains": ["Nothing to release"],
    "check_not_contains": []
  }
}
