{
  "meta": {
    "name": "tag-template-v-only",
    "description": "Single package with standard v{version} tag template"
  },
  "config": {
    "content": "{\n  \"workspace\": {\n    \"tag_template\": \"v{version}\"\n  },\n  \"package\": [\n    {\n      \"name\": \"myapp\",\n      \"path\": \".\",\n      \"versioned_files\": [{\"path\": \"version.toml\", \"format\": \"toml\"}]\n    }\n  ]\n}\n"
  },
  "packages": [
    {
      "name": "myapp",
      "path": ".",
      "initial_version": "1.0.0",
      "tag": "v1.0.0"
    }
  ],
  "commits": [
    {
      "message": "feat: add dashboard",
      "files": ["src/dashboard.rs"]
    }
  ],
  "expect": {
    "check_contains": ["myapp", "1.1.0"],
    "check_not_contains": ["Nothing to release"]
  }
}
