{
  "meta": {
    "name": "tag-template-name-at-version",
    "description": "Monorepo tag template using {name}@v{version} pattern"
  },
  "config": {
    "content": "{\n  \"workspace\": {\n    \"tag_template\": \"{name}@v{version}\"\n  },\n  \"package\": [\n    {\n      \"name\": \"core\",\n      \"path\": \"core\",\n      \"versioned_files\": [{\"path\": \"core/version.toml\", \"format\": \"toml\"}]\n    },\n    {\n      \"name\": \"cli\",\n      \"path\": \"cli\",\n      \"versioned_files\": [{\"path\": \"cli/version.toml\", \"format\": \"toml\"}]\n    }\n  ]\n}\n"
  },
  "packages": [
    {
      "name": "core",
      "path": "core",
      "initial_version": "1.0.0",
      "tag": "core@v1.0.0"
    },
    {
      "name": "cli",
      "path": "cli",
      "initial_version": "1.0.0",
      "tag": "cli@v1.0.0"
    }
  ],
  "commits": [
    {
      "message": "feat(core): add new feature",
      "files": ["core/src/lib.rs"]
    }
  ],
  "expect": {
    "check_contains": ["core", "1.1.0"],
    "check_not_contains": ["Nothing to release", "cli"]
  }
}
